{
  "id": "lakera",
  "name": "Lakera",
  "category": "Commercial firms",
  "summary": "Developer-first runtime security, Gandalf prompt-injection evaluation dataset",
  "website": null,
  "review_status": "pending",
  "political_affiliation": {
    "status": "unknown"
  },
  "claims": [],
  "provenance": {
    "origin": "Initial user-supplied directory; imported 2026-09-12",
    "note": "Name, category, and summary await source review. Unsourced funding and political characterizations excluded."
  }
}
