{
  "id": "adversa-ai",
  "name": "Adversa AI",
  "category": "Commercial firms",
  "summary": "Adversarial attacks, continuous red-teaming, prompt injection defenses",
  "website": null,
  "review_status": "pending",
  "political_affiliation": {
    "status": "unknown"
  },
  "claims": [],
  "provenance": {
    "origin": "Initial user-supplied directory; imported 2026-09-12",
    "note": "Name, category, and summary await source review. Unsourced funding and political characterizations excluded."
  }
}
