{
  "id": "oxford-future-of-humanity-institute-fhi-legacy-alignment-researchers",
  "name": "Oxford Future of Humanity Institute (FHI - Legacy) / Alignment Researchers",
  "category": "Academic centers",
  "summary": "Foundational existential risk, trajectory analysis, macro-strategy",
  "website": null,
  "review_status": "pending",
  "political_affiliation": {
    "status": "unknown"
  },
  "claims": [],
  "provenance": {
    "origin": "Initial user-supplied directory; imported 2026-09-12",
    "note": "Name, category, and summary await source review. Unsourced funding and political characterizations excluded."
  }
}
