{
  "id": "saferai",
  "name": "SaferAI",
  "category": "Nonprofits & research",
  "summary": "Systemic AI risk audits, Assurance 2.0 framework for frontier labs",
  "website": null,
  "review_status": "pending",
  "political_affiliation": {
    "status": "unknown"
  },
  "claims": [
    {
      "id": "funding-disclosure",
      "field": "funding",
      "statement": "Effektiv Spenden reports allocating €170,227 to SaferAI in 2025. This allocation does not establish its largest funder or total revenue.",
      "source_ids": [
        "saferai-funding"
      ],
      "evidence_type": "primary_source",
      "review_status": "pending"
    }
  ],
  "provenance": {
    "origin": "Initial user-supplied directory; imported 2026-09-12",
    "note": "Name, category, and summary await source review. Unsourced funding and political characterizations excluded."
  }
}
