{
  "id": "haize-labs",
  "name": "Haize Labs",
  "category": "Commercial firms",
  "summary": "Automated red-teaming at scale, agentic safety boundaries, stress-testing",
  "website": null,
  "review_status": "pending",
  "political_affiliation": {
    "status": "unknown"
  },
  "claims": [
    {
      "id": "funding-disclosure",
      "field": "funding",
      "statement": "Haize lists a $12.5M seed round led by General Catalyst and participation in AI Grant Batch 4. The earlier supplied Y Combinator attribution is not supported by this source.",
      "source_ids": [
        "haize-labs-funding"
      ],
      "evidence_type": "primary_source",
      "review_status": "pending"
    }
  ],
  "provenance": {
    "origin": "Initial user-supplied directory; imported 2026-09-12",
    "note": "Name, category, and summary await source review. Unsourced funding and political characterizations excluded."
  }
}
