{
  "id": "calypsoai",
  "name": "CalypsoAI",
  "category": "Commercial firms",
  "summary": "Model security auditing, automated red-teaming for defense and intelligence",
  "website": null,
  "review_status": "pending",
  "political_affiliation": {
    "status": "unknown"
  },
  "claims": [],
  "provenance": {
    "origin": "Initial user-supplied directory; imported 2026-09-12",
    "note": "Name, category, and summary await source review. Unsourced funding and political characterizations excluded."
  }
}
