{
  "id": "far-ai-foundations-of-alignment-research",
  "name": "FAR AI (Foundations of Alignment Research)",
  "category": "Nonprofits & research",
  "summary": "Adversarial robustness, jailbreak resistance, red-team benchmarks",
  "website": null,
  "review_status": "pending",
  "political_affiliation": {
    "status": "unknown"
  },
  "claims": [],
  "provenance": {
    "origin": "Initial user-supplied directory; imported 2026-09-12",
    "note": "Name, category, and summary await source review. Unsourced funding and political characterizations excluded."
  }
}
