{
  "id": "cooperative-ai-foundation-caif",
  "name": "Cooperative AI Foundation (CAIF)",
  "category": "Nonprofits & research",
  "summary": "Multi-agent cooperation, game-theoretic multi-system safety",
  "website": null,
  "review_status": "pending",
  "political_affiliation": {
    "status": "unknown"
  },
  "claims": [],
  "provenance": {
    "origin": "Initial user-supplied directory; imported 2026-09-12",
    "note": "Name, category, and summary await source review. Unsourced funding and political characterizations excluded."
  }
}
