{
  "id": "uk-ai-security-institute-uk-aisi-formerly-uk-ai-safety-institute",
  "name": "UK AI Security Institute (UK AISI / formerly UK AI Safety Institute)",
  "category": "Government bodies",
  "summary": "Autonomous cyber threats, societal resilience, empirical red-teaming",
  "website": null,
  "review_status": "pending",
  "political_affiliation": {
    "status": "unknown"
  },
  "claims": [],
  "provenance": {
    "origin": "Initial user-supplied directory; imported 2026-09-12",
    "note": "Name, category, and summary await source review. Unsourced funding and political characterizations excluded."
  }
}
