{
  "id": "humane-intelligence",
  "name": "Humane Intelligence",
  "category": "Nonprofits & research",
  "summary": "Community-driven algorithmic red-teaming, public bias/safety bug bounties (e.g., DEF CON)",
  "website": null,
  "review_status": "pending",
  "political_affiliation": {
    "status": "unknown"
  },
  "claims": [],
  "provenance": {
    "origin": "Initial user-supplied directory; imported 2026-09-12",
    "note": "Name, category, and summary await source review. Unsourced funding and political characterizations excluded."
  }
}
