{
  "id": "braintrust",
  "name": "Braintrust",
  "category": "Commercial firms",
  "summary": "AI observability, automated eval pipelines, regression testing for model updates",
  "website": null,
  "review_status": "pending",
  "political_affiliation": {
    "status": "unknown"
  },
  "claims": [],
  "provenance": {
    "origin": "Initial user-supplied directory; imported 2026-09-12",
    "note": "Name, category, and summary await source review. Unsourced funding and political characterizations excluded."
  }
}
