{
  "id": "galileo",
  "name": "Galileo",
  "category": "Commercial firms",
  "summary": "Evaluation, debugging, and guardrail platforms for generative AI workflows",
  "website": null,
  "review_status": "pending",
  "political_affiliation": {
    "status": "unknown"
  },
  "claims": [],
  "provenance": {
    "origin": "Initial user-supplied directory; imported 2026-09-12",
    "note": "Name, category, and summary await source review. Unsourced funding and political characterizations excluded."
  }
}
